{
  "$schema": "http://json-schema.org/draft-07/schema#",
  "$id": "policy_definition_schema.json",
  "title": "PolicyDefinition",
  "description": "JSON Schema for validating governance policy definition documents. Policies define conditions, priority, and outcomes for the Policy Engine evaluation pipeline.",
  "type": "object",
  "required": ["policy_id", "version", "priority", "conditions", "outcome"],
  "properties": {
    "policy_id": {
      "type": "string",
      "description": "Unique identifier for the policy.",
      "minLength": 1
    },
    "version": {
      "type": "integer",
      "description": "Monotonically increasing version number.",
      "minimum": 1
    },
    "priority": {
      "type": "integer",
      "description": "Policy priority for conflict resolution. Lower numeric value indicates higher priority.",
      "minimum": 0
    },
    "conditions": {
      "type": "object",
      "description": "Conditions under which this policy applies to an action request.",
      "properties": {
        "scope_level": {
          "type": "integer",
          "description": "The agent scope level (0-4) this policy applies to.",
          "minimum": 0,
          "maximum": 4
        },
        "action_group": {
          "type": "string",
          "description": "The action group name this policy applies to."
        },
        "target_resource": {
          "type": "string",
          "description": "The target resource type this policy applies to."
        },
        "time_of_day": {
          "type": "object",
          "description": "Time-of-day constraint with start and end times.",
          "properties": {
            "start": {
              "type": "string",
              "description": "Start time in HH:MM format."
            },
            "end": {
              "type": "string",
              "description": "End time in HH:MM format."
            }
          },
          "required": ["start", "end"],
          "additionalProperties": false
        }
      },
      "additionalProperties": false
    },
    "outcome": {
      "type": "string",
      "description": "The governance decision outcome when this policy matches.",
      "enum": ["allow", "deny", "escalate"]
    },
    "name": {
      "type": "string",
      "description": "Human-readable policy name."
    },
    "description": {
      "type": "string",
      "description": "Detailed description of the policy."
    },
    "owner": {
      "type": "string",
      "description": "Identity of the policy owner."
    },
    "approval_status": {
      "type": "string",
      "description": "Current approval status (e.g., approved, pending, draft)."
    },
    "created_at": {
      "type": "string",
      "description": "ISO 8601 timestamp of policy creation."
    },
    "updated_at": {
      "type": "string",
      "description": "ISO 8601 timestamp of last policy update."
    },
    "binding": {
      "type": "object",
      "description": "Agents the policy applies to, selected by trusted registry attributes (P0-17). Every dimension present must match; within a dimension any listed value matches. Absent means the policy applies to every agent.",
      "properties": {
        "policy_bundles": {"$ref": "#/definitions/selector"},
        "risk_tiers": {"$ref": "#/definitions/selector"},
        "agent_types": {"$ref": "#/definitions/selector"},
        "environments": {"$ref": "#/definitions/selector"},
        "agent_ids": {"$ref": "#/definitions/selector"}
      },
      "additionalProperties": false
    }
  },
  "definitions": {
    "selector": {
      "type": "array",
      "items": {"type": "string", "minLength": 1},
      "minItems": 1
    }
  },
  "additionalProperties": false
}
