{
  "policy_id": "default-deny",
  "version": 1,
  "name": "Default Deny Policy",
  "description": "Catch-all policy that denies any action not explicitly allowed by a higher-priority policy.",
  "priority": 9999,
  "conditions": {},
  "outcome": "deny",
  "owner": "governance-admin",
  "approval_status": "approved",
  "created_at": "2025-01-15T00:00:00Z",
  "updated_at": "2025-01-15T00:00:00Z"
}
