{
  "policy_id": "deny-production-deployment-below-scope-3",
  "version": 1,
  "name": "Deny Production Deployment Below Scope 3",
  "description": "Denies production deployment actions for agents below scope level 3. Production deployments require elevated privileges.",
  "priority": 50,
  "conditions": {
    "scope_level": 2,
    "action_group": "ProductionDeployment",
    "target_resource": "production"
  },
  "outcome": "deny",
  "owner": "governance-admin",
  "approval_status": "approved",
  "created_at": "2025-01-15T00:00:00Z",
  "updated_at": "2025-01-15T00:00:00Z"
}
