{
  "policy_id": "allow-read-at-scope-1",
  "version": 1,
  "name": "Allow Read at Scope 1",
  "description": "Allows read-only pipeline status queries for agents at scope level 1 or above.",
  "priority": 100,
  "conditions": {
    "scope_level": 1,
    "action_group": "ReadPipelineStatus"
  },
  "outcome": "allow",
  "owner": "governance-admin",
  "approval_status": "approved",
  "created_at": "2025-01-15T00:00:00Z",
  "updated_at": "2025-01-15T00:00:00Z"
}
